{
  "artifacts": {
    "benchmark": null,
    "language_model": {
      "bytes": 1918563,
      "format": "KBTD-v1 compact bi-trigram",
      "path": "telugu_langdata.bin",
      "sha256": "7ae42d738aed69ceb6edaa1195e89504f4e6266fa3218ad7d644aa86683de342"
    },
    "layout": {
      "bytes": 4288,
      "format": "binary-plist Telugu-layout-v1",
      "path": "telugu_layout.kbpack",
      "sha256": "486d12c6748b0221ecbe641028f33174cbe45b7b1d9bc2ea55886e6f17caedd9"
    },
    "lexicon": {
      "bytes": 1918563,
      "format": "KBTD-v1 compact scalar trie",
      "path": "telugu_langdata.bin",
      "sha256": "7ae42d738aed69ceb6edaa1195e89504f4e6266fa3218ad7d644aa86683de342"
    },
    "safety": null,
    "transliteration_fst": null,
    "transliteration_lexicon": {
      "bytes": 967207,
      "format": "KBXL-v3 weighted lexicon + Roman bi-trigram",
      "path": "tenglish_lexicon.bin",
      "sha256": "e56b0f57500e41a638fa975d674bb9f06dcd36ea71f1dbad0447e1b108bb830d"
    }
  },
  "benchmark_hash": null,
  "benchmark_version": "telugu-beta-unvalidated-v2",
  "build": {
    "aksharantar_accepted_rows": 2429539,
    "aksharantar_archive_sha256": "08f1c2841f4d02fcc2a56362f7760ec16fc52d8a199029c68d44024ab0d22c1a",
    "aksharantar_rejected_rows": 23,
    "bigram_context_count": 748,
    "bigram_continuation_count": 17868,
    "corpus_manifest_sha256": "93491c605b2b5e90458e50cd8970f1852aa849fe50b0d0ba21a86c1024ad2215",
    "corpus_sources": {
      "indiccorpv2_telugu_stratified_2026_07_20": {
        "count_weight": 1,
        "domain": "news",
        "duplicates": 0,
        "language": "telugu",
        "max_sentences": 100000,
        "rejected": 0,
        "sample_admissions": 100000,
        "scanned": 100000,
        "selected": 100000,
        "valid": 100000
      },
      "tatoeba_telugu_2026_07_19": {
        "contributors": [
          "AlphaSteppeNomad",
          "Balamax",
          "bharath",
          "cntrational",
          "epraneeth98",
          "frpzzd",
          "Hari",
          "NigerianSmiths",
          "nurendra",
          "ramanirudh",
          "rarmdhyymm",
          "simley",
          "strykerami"
        ],
        "count_weight": 2,
        "domain": "mixed",
        "duplicates": 0,
        "language": "telugu",
        "max_sentences": 50000,
        "rejected": 0,
        "sample_admissions": 318,
        "scanned": 318,
        "selected": 318,
        "valid": 318
      }
    },
    "direct_roman_corpus_sentence_count": 0,
    "max_roman_keys": 12000,
    "max_variants": 3,
    "max_words": 22000,
    "native_bigram_byte_budget": 114688,
    "native_bigram_dropped_context_count": 20468,
    "native_bigram_dropped_continuation_count": 344445,
    "native_bigram_encoded_bytes": 114688,
    "native_bigram_max_continuations_per_context": 24,
    "native_bigram_observed_context_count": 21216,
    "native_bigram_observed_continuation_count": 362313,
    "native_bigram_retained_context_count": 748,
    "native_bigram_retained_continuation_count": 17868,
    "native_corpus_sentence_count": 100318,
    "native_trigram_byte_budget": 114688,
    "native_trigram_dropped_context_count": 270414,
    "native_trigram_dropped_continuation_count": 351717,
    "native_trigram_encoded_bytes": 114684,
    "native_trigram_max_continuations_per_context": 24,
    "native_trigram_observed_context_count": 271472,
    "native_trigram_observed_continuation_count": 368715,
    "native_trigram_retained_context_count": 1058,
    "native_trigram_retained_continuation_count": 16998,
    "reviewed_core_rows": 69,
    "roman_bigram_byte_budget": 49152,
    "roman_bigram_context_count": 628,
    "roman_bigram_continuation_count": 7145,
    "roman_bigram_dropped_context_count": 3954,
    "roman_bigram_dropped_continuation_count": 33485,
    "roman_bigram_encoded_bytes": 49150,
    "roman_bigram_max_continuations_per_context": 12,
    "roman_bigram_observed_context_count": 4582,
    "roman_bigram_observed_continuation_count": 40630,
    "roman_bigram_retained_context_count": 628,
    "roman_bigram_retained_continuation_count": 7145,
    "roman_key_count": 12000,
    "roman_trigram_byte_budget": 49152,
    "roman_trigram_context_count": 2123,
    "roman_trigram_continuation_count": 3946,
    "roman_trigram_dropped_context_count": 7318,
    "roman_trigram_dropped_continuation_count": 7386,
    "roman_trigram_encoded_bytes": 49152,
    "roman_trigram_max_continuations_per_context": 12,
    "roman_trigram_observed_context_count": 9441,
    "roman_trigram_observed_continuation_count": 11332,
    "roman_trigram_retained_context_count": 2123,
    "roman_trigram_retained_continuation_count": 3946,
    "roman_variant_count": 20028,
    "synthetic_roman_sentence_count": 100318,
    "tatoeba_contributors": [
      "AlphaSteppeNomad",
      "Balamax",
      "bharath",
      "cntrational",
      "epraneeth98",
      "frpzzd",
      "Hari",
      "NigerianSmiths",
      "nurendra",
      "ramanirudh",
      "rarmdhyymm",
      "simley",
      "strykerami"
    ],
    "tatoeba_sentence_count": 318,
    "trie_edge_count": 62719,
    "trie_node_count": 62720,
    "trigram_context_count": 1058,
    "trigram_continuation_count": 16998,
    "word_count": 22000
  },
  "identifier": "te-IN-apple-mobile",
  "input_modes": [
    "tenglish_to_telugu",
    "roman_telugu",
    "telugu"
  ],
  "locale": "te_IN",
  "minimum_ios": "18.0",
  "native_speaker_reviewed": false,
  "normalization": "NFC",
  "provenance": [
    {
      "attribution": "Project-authored geometry; Unicode character coverage",
      "license": "Reference implementation data; screenshots are not redistributed",
      "license_url": "https://www.unicode.org/cldr/charts/41/keyboards/layouts/te.html",
      "name": "Project-authored Apple-mobile Telugu layout source",
      "purpose": "layout",
      "release_eligible": true,
      "research_only": false,
      "sha256": "65851c575bb67c79cf60f44056d748de6c87d31f40209ea77892ee4f8fcdd176",
      "source_revision": "layout-v2",
      "split": "none",
      "url": "https://medium.com/@pravynandas/telugu-typing-in-iphone-%E0%B0%90%E0%B0%AB%E0%B1%8B%E0%B0%A8%E0%B1%8D-%E0%B0%B2%E0%B1%8B-%E0%B0%A4%E0%B1%86%E0%B0%B2%E0%B1%81%E0%B0%97%E0%B1%81-2d6669344b6f"
    },
    {
      "attribution": "AI4Bharat Aksharantar contributors",
      "license": "CC-BY for manually collected rows; CC0 for mined/existing rows",
      "license_url": "https://huggingface.co/datasets/ai4bharat/Aksharantar#licensing-information",
      "name": "AI4Bharat Aksharantar/tel_train.json",
      "purpose": "training",
      "release_eligible": true,
      "research_only": false,
      "sha256": "eb77e61d9bc2b3fc4ed1f94d5b56f0fdf0f13c916ea7bb66b1c810f5f00e55f8",
      "source_revision": "tel_train.json",
      "split": "train",
      "url": "https://huggingface.co/datasets/ai4bharat/Aksharantar"
    },
    {
      "attribution": "Glyph project reviewed aliases",
      "license": "Project-authored",
      "license_url": "project://THIRD_PARTY_NOTICES.md",
      "name": "Project-reviewed core Tenglish aliases",
      "purpose": "training",
      "release_eligible": true,
      "research_only": false,
      "sha256": "cdd84b73352510ce307e6024d2cb94ba9751bf9409b1acbdc71eae7a2d60a8be",
      "source_revision": "cdd84b73352510ce307e6024d2cb94ba9751bf9409b1acbdc71eae7a2d60a8be",
      "split": "train",
      "url": "project://tools/language_packs/sources/te-IN/tenglish-core-reviewed.tsv"
    },
    {
      "attribution": "AI4Bharat IndicCorpV2; 32 deterministic 1 MiB strata recorded in the preparation reports",
      "license": "CC0-1.0",
      "license_url": "https://creativecommons.org/publicdomain/zero/1.0/",
      "name": "IndicCorpV2 Telugu deterministic stratified sample",
      "purpose": "training",
      "release_eligible": true,
      "research_only": false,
      "sha256": "744556a1da885bba747c629add17599d926c9bcc924d0dfbb60d750181d62230",
      "source_revision": "2d7285e6ce14fdb3fb2449c9f89427b9f582ac3f",
      "split": "train",
      "url": "https://huggingface.co/datasets/ai4bharat/IndicCorpV2/blob/2d7285e6ce14fdb3fb2449c9f89427b9f582ac3f/data/te.txt"
    },
    {
      "attribution": "Tatoeba contributors listed in the generated pack manifest",
      "license": "CC BY 2.0 FR",
      "license_url": "https://creativecommons.org/licenses/by/2.0/fr/",
      "name": "Tatoeba Telugu detailed sentences",
      "purpose": "training",
      "release_eligible": true,
      "research_only": false,
      "sha256": "833268b5ac5b18f69903594a8e8c5ab7cbfdaa9f1d6f69e6dc927282cdc9da9c",
      "source_revision": "snapshot-2026-07-19",
      "split": "train",
      "url": "https://downloads.tatoeba.org/exports/per_language/tel/"
    }
  ],
  "release_status": "research",
  "schema_version": 2,
  "version": 2
}
